{
  "$schema": "screen-acceptance.schema.json",
  "schema_id": "codex.ui-screen-acceptance/v1",
  "screen_revision_id": "UI-DASH-001.loading.all.ru.graphite@r5",
  "screen_id": "UI-DASH-001",
  "state_id": "UI-DASH-001.loading",
  "accessibility_claim": "accessibility_smoke",
  "generated_by": {
    "script": "assemble_screen_acceptance.py",
    "version": "2.0.0",
    "command": "assemble_screen_acceptance.py <paths-redacted>"
  },
  "contract_input": {
    "path": ".codex/delivery/ui-design-programs/custometry-v2/artifacts/g4-r5/family-dash-shell-workspace-baseline/states/loading/screen-contract.json",
    "sha256": "8750f1e874e3a62a3922e4cfc0ff54840c8be5d3784e0713e4e6ea20520426e5"
  },
  "required_anchor_ids": [
    "web-768",
    "web-1024",
    "web-1440",
    "web-1920"
  ],
  "anchor_receipts": [
    {
      "anchor_id": "web-768",
      "path": ".codex/delivery/ui-design-programs/custometry-v2/evidence/family.dash.shell-workspace.baseline-r5/states/loading/web-768/visual-qa.json",
      "sha256": "d6d2d6161a25de3bcefe35971210ce1e321901f1fc1d6d00bfefaf05dea4efc4",
      "result": "passed",
      "accessibility_passed": true,
      "keyboard_passed": true,
      "standard_passed": true
    },
    {
      "anchor_id": "web-1024",
      "path": ".codex/delivery/ui-design-programs/custometry-v2/evidence/family.dash.shell-workspace.baseline-r5/states/loading/web-1024/visual-qa.json",
      "sha256": "1e2cea99cb9c1ab049ed072c486f5b17bdbf7725288107d673078472a13098dc",
      "result": "passed",
      "accessibility_passed": true,
      "keyboard_passed": true,
      "standard_passed": true
    },
    {
      "anchor_id": "web-1440",
      "path": ".codex/delivery/ui-design-programs/custometry-v2/evidence/family.dash.shell-workspace.baseline-r5/states/loading/web-1440/visual-qa.json",
      "sha256": "73c76b548ce8af2ee127ddb37bde8fc08ae416ffc93f93ba9468342e63458507",
      "result": "passed",
      "accessibility_passed": true,
      "keyboard_passed": true,
      "standard_passed": true
    },
    {
      "anchor_id": "web-1920",
      "path": ".codex/delivery/ui-design-programs/custometry-v2/evidence/family.dash.shell-workspace.baseline-r5/states/loading/web-1920/visual-qa.json",
      "sha256": "2c143485ea3c815180fa45ecfc78626de27ddeff8be2ac1539b643977fe46244",
      "result": "passed",
      "accessibility_passed": true,
      "keyboard_passed": true,
      "standard_passed": true
    }
  ],
  "standard_coverage": {
    "standard_revision_id": "custometry.pilot-standard.v3.metadata.r5",
    "clause_inventory_sha256": "f2ca158c083c0d225d8fc25dd87226787fe20863e4e56f7e5b99fb2d3574c1de",
    "applicability_manifest_sha256": "3a4de2bec2fdb9e2487b5e0a7d56408aba28d023a2641b42ac19ca24c3b01134",
    "expected_clause_ids": [
      "standard.border.border-color.113f1c240f04",
      "standard.border.border-color.32e1f263db9b",
      "standard.border.border-color.33cdc578907b",
      "standard.border.border-color.6021d9ecb051",
      "standard.border.border-color.6eeb36a193a0",
      "standard.border.border-color.75a3b865617f",
      "standard.border.border-color.79c29fcc9331",
      "standard.border.border-color.996dd8e7d7d9",
      "standard.border.border-style.5a19575b3c18",
      "standard.border.border-style.f2f52c7112bf",
      "standard.border.border-width.3474aa875405",
      "standard.border.border-width.3a4c93b94679",
      "standard.color.background-color.08a050bf7798",
      "standard.color.background-color.0b3382443268",
      "standard.color.background-color.11cb2df3e428",
      "standard.color.background-color.54ba9843a31f",
      "standard.color.background-color.5a8397c5052a",
      "standard.color.background-color.62dbc7c2f815",
      "standard.color.background-color.81f8708f46c1",
      "standard.color.background-color.f5ce5f252864",
      "standard.color.color.423a62b4e43b",
      "standard.color.color.558df6c1a818",
      "standard.color.color.61e66af7483e",
      "standard.color.color.766c2bf6d0a9",
      "standard.color.color.9f64a97a6e82",
      "standard.color.color.c863c07a7c53",
      "standard.elevation.box-shadow.37337d6fe8c1",
      "standard.elevation.box-shadow.47855f6e7502",
      "standard.elevation.box-shadow.78c4a0c777cd",
      "standard.elevation.box-shadow.846dd608356a",
      "standard.elevation.box-shadow.cd848ab1bf52",
      "standard.elevation.box-shadow.d0a31290ffda",
      "standard.elevation.box-shadow.e19da9138878",
      "standard.focus.outline-color.068da97ecd02",
      "standard.focus.outline-color.2d1c10789901",
      "standard.focus.outline-color.3f0aafaa6634",
      "standard.focus.outline-color.47cc5caf5af5",
      "standard.focus.outline-color.6eddfee609e1",
      "standard.focus.outline-color.f62f644ab604",
      "standard.focus.outline-style.5f4017179266",
      "standard.focus.outline-width.fb16926059df",
      "standard.layout.display.1a4f8041ef71",
      "standard.layout.display.5b8bdc5ac602",
      "standard.layout.display.880a101b7ddb",
      "standard.layout.display.a4bee902fcee",
      "standard.layout.display.c7249af1ff30",
      "standard.layout.position.0be8f94559c2",
      "standard.layout.position.559fa61c2c4b",
      "standard.layout.position.6b167b5a90e5",
      "standard.layout.position.d54cf8c43cc2",
      "standard.motion.transition-duration.aa523ffbc72d",
      "standard.motion.transition-property.38a35f26200d",
      "standard.motion.transition-property.4b701e9dcb3f",
      "standard.motion.transition-property.608dc2556646",
      "standard.motion.transition-property.7cb49513c248",
      "standard.motion.transition-property.969dda741cf4",
      "standard.motion.transition-property.c9f3779f516c",
      "standard.motion.transition-property.ed79867d5460",
      "standard.opacity.opacity.3f43cc20e0ec",
      "standard.radius.border-radius.054f6effc63a",
      "standard.radius.border-radius.23288213488d",
      "standard.radius.border-radius.5ce1c9180749",
      "standard.radius.border-radius.706762912380",
      "standard.radius.border-radius.c7b79d896e0f",
      "standard.radius.border-radius.e205a326be00",
      "standard.radius.border-radius.eb47cec1141b",
      "standard.radius.border-radius.f14e9b21c7bd",
      "standard.responsive.overflow-x.5d305ebffed6",
      "standard.responsive.overflow-x.67f70c28374d",
      "standard.responsive.overflow-x.714843af0d04",
      "standard.responsive.overflow-y.7ab4b6c5f2e9",
      "standard.responsive.overflow-y.b74f9167e03e",
      "standard.responsive.overflow-y.e2f12b4e45c3",
      "standard.sizing.height.037a51fa3c4e",
      "standard.sizing.height.36d47c93e789",
      "standard.sizing.height.3939db2d8468",
      "standard.sizing.height.3a940033701a",
      "standard.sizing.height.3f73bde3804b",
      "standard.sizing.height.40547cd907b4",
      "standard.sizing.height.4dd7e57e8fd3",
      "standard.sizing.height.4e2943482ade",
      "standard.sizing.height.52637ffbc3af",
      "standard.sizing.height.5898615f3481",
      "standard.sizing.height.5fe97f3b848c",
      "standard.sizing.height.80338eb92219",
      "standard.sizing.height.a5aaf64f1da9",
      "standard.sizing.height.a862ade8dbd4",
      "standard.sizing.height.aa2de3467cc7",
      "standard.sizing.height.b5dff0e5c365",
      "standard.sizing.height.bfa5d7dc6fce",
      "standard.sizing.height.da231839ebd1",
      "standard.sizing.height.e15ac8e1ac43",
      "standard.sizing.height.efe678b60045",
      "standard.sizing.height.f966fbc53444",
      "standard.sizing.max-height.6de12e13956d",
      "standard.sizing.max-width.7fd14661c987",
      "standard.sizing.max-width.b17c4b251e6e",
      "standard.sizing.min-height.1db5bd1508b4",
      "standard.sizing.min-height.5193aa2dcbfc",
      "standard.sizing.min-height.688a58aeea92",
      "standard.sizing.min-height.769ae775055b",
      "standard.sizing.min-height.7ba4bbd31a0d",
      "standard.sizing.min-height.816c7f24bb71",
      "standard.sizing.min-height.8ec53f8779d5",
      "standard.sizing.min-height.a098004b8ec2",
      "standard.sizing.min-height.a5b34efb2d57",
      "standard.sizing.min-height.bc07e3400e95",
      "standard.sizing.min-height.e4228f7c8fe0",
      "standard.sizing.min-width.0215441dc5c5",
      "standard.sizing.min-width.0fa82aaa5ae1",
      "standard.sizing.min-width.0fd90b874a80",
      "standard.sizing.min-width.2a43ab3ff7b4",
      "standard.sizing.min-width.acda65ae99f2",
      "standard.sizing.min-width.ba2f396d3cc1",
      "standard.sizing.width.0452f5addf27",
      "standard.sizing.width.0673ea0e08a8",
      "standard.sizing.width.0e2634dc59c7",
      "standard.sizing.width.1042fc3cdc65",
      "standard.sizing.width.159db49f8119",
      "standard.sizing.width.21c95389aad8",
      "standard.sizing.width.2201827cfa77",
      "standard.sizing.width.2966c69261b9",
      "standard.sizing.width.2ff5e7523c8c",
      "standard.sizing.width.32eccbdcd6d6",
      "standard.sizing.width.34e63d379e4a",
      "standard.sizing.width.40cbce346d0a",
      "standard.sizing.width.4e681766b122",
      "standard.sizing.width.59d48d4c7160",
      "standard.sizing.width.5a3421bbbd07",
      "standard.sizing.width.6590433ac104",
      "standard.sizing.width.6afacb36b4dc",
      "standard.sizing.width.6d721bb507f1",
      "standard.sizing.width.717d17866098",
      "standard.sizing.width.752ac0a35e71",
      "standard.sizing.width.785983823b1b",
      "standard.sizing.width.78ffe3a6203c",
      "standard.sizing.width.8cd816f79543",
      "standard.sizing.width.9022b0a38799",
      "standard.sizing.width.95adab953630",
      "standard.sizing.width.ae096f30b6b1",
      "standard.sizing.width.b26a64e529a6",
      "standard.sizing.width.bae08826a54c",
      "standard.sizing.width.bc97bf255aea",
      "standard.sizing.width.c3850186da89",
      "standard.sizing.width.c4dc1310e079",
      "standard.sizing.width.c89b26b9fd5c",
      "standard.sizing.width.cb72eacaa709",
      "standard.sizing.width.fac8ff37daf4",
      "standard.spacing.column-gap.1205bb257e63",